<?xml version="1.0" encoding="UTF-8"?>
<schema xmlns="http://www.w3.org/2001/XMLSchema" targetNamespace="http://www.szamlazz.hu/xmlszamlast" xmlns:tns="http://www.szamlazz.hu/xmlszamlast" elementFormDefault="qualified">
    <complexType name="vevoTipus">
        <sequence>
            <element name="email" type="string" maxOccurs="1" minOccurs="0"></element>
            <element name="adoszam"   type="string" maxOccurs="1" minOccurs="0"></element>
            <element name="adoszamEU" type="string" maxOccurs="1" minOccurs="0"></element>
        </sequence>
    </complexType>
    <complexType name="eladoTipus">
        <sequence>
            <element name="emailReplyto" type="string" maxOccurs="1" minOccurs="0"></element>
            <element name="emailTargy" type="string" maxOccurs="1" minOccurs="0"></element>
            <element name="emailSzoveg" type="string" maxOccurs="1" minOccurs="0"></element>
        </sequence>
    </complexType>
    <complexType name="beallitasokTipus">
        <sequence>
            <element name="felhasznalo" type="string" maxOccurs="1" minOccurs="0"></element>
            <element name="jelszo" type="string" maxOccurs="1" minOccurs="0"></element>
            <element name="szamlaagentkulcs" type="string" maxOccurs="1" minOccurs="0"></element>
            <element name="eszamla" type="boolean" maxOccurs="1" minOccurs="1"></element>
            <element name="szamlaLetoltes" type="boolean" maxOccurs="1" minOccurs="1"></element>
            <element name="szamlaLetoltesPld" type="int" maxOccurs="1" minOccurs="0"></element>
            <element name="aggregator" type="string" maxOccurs="1" minOccurs="0"></element>
            <element name="guardian" type="boolean" maxOccurs="1" minOccurs="0"></element>
            <element name="valaszVerzio" type="int" maxOccurs="1" minOccurs="0"></element>
            <element name="szamlaKulsoAzon" type="string" maxOccurs="1" minOccurs="0"></element>
        </sequence>
    </complexType>
    <complexType name="fejlecTipus">
        <sequence>
            <element name="szamlaszam"      type="string" maxOccurs="1" minOccurs="1"></element>
            <element name="keltDatum"       type="date"   maxOccurs="1" minOccurs="0"></element>
            <element name="teljesitesDatum" type="date"   maxOccurs="1" minOccurs="0"></element>
            <element name="megjegyzes"      type="string" maxOccurs="1" minOccurs="0"></element> <!-- itt megadhatod szövegesen a sztornózás okát -->
            <element name="tipus"           type="string" maxOccurs="1" minOccurs="0"></element>
            <element name="szamlaSablon"    type="string" maxOccurs="1" minOccurs="0"></element> <!-- Értékkészlet: 'SzlaMost' | 'SzlaAlap' | 'SzlaNoEnv' | 'Szla8cm' | 'SzlaTomb' | 'SzlaFuvarlevelesAlap' -->
        </sequence>
    </complexType>

    <element name="xmlszamlast">
	    <complexType>
	        <sequence>
	            <element name="beallitasok" type="tns:beallitasokTipus" maxOccurs="1" minOccurs="1"></element>
	            <element name="fejlec" type="tns:fejlecTipus" maxOccurs="1" minOccurs="1"></element>
	            <element name="elado" type="tns:eladoTipus" maxOccurs="1" minOccurs="0"></element>
	            <element name="vevo" type="tns:vevoTipus" maxOccurs="1" minOccurs="0"></element>
	        </sequence>
	    </complexType>
    </element>
</schema>
